{
  "schema_version": "1.0.0",
  "dataset_id": "copernicus.cems.on-demand-mapping",
  "provider": "Copernicus Emergency Management Service (CEMS) / European Commission",
  "product_name": "Copernicus EMS On-Demand Mapping public activation metadata and mapping products",
  "version_or_release": null,
  "canonical_source": "https://mapping.emergency.copernicus.eu/",
  "retrieved_at": "2026-08-12T08:31:00Z",
  "retrieval_query_or_filters": "Metadata-only review of the public CEMS On-Demand Mapping portal, harvesting documentation, Emergency Response API documentation and terms. No activation product bytes were downloaded or admitted. Initial machine-access scope is the anonymous public Rapid Mapping activation catalogue and bounded activation metadata; the admitted metadata slice excludes free-text narrative, sensitive/restricted records and third-party-bearing content. Any future product acquisition must freeze activation code, AOI, product type/version, acquisition time, returned files and byte hashes.",
  "access_class": "open",
  "modelling_layer": "hazard",
  "intended_use": "Post-event event-footprint, hazard-observation and damage-grading validation source for floods, wildfires, storms, earthquakes and other mapped emergencies. Public activation/AOI/product metadata can link observed event geometry, satellite acquisition context and mapped impact statistics to independently modelled hazard outputs. CEMS mapping products are not a stochastic event catalogue, vulnerability function, insured-loss dataset or universal ground-truth layer, and product feasibility/quality varies by activation and sensor conditions.",
  "raw_artifact": null,
  "derived_artifact": null,
  "licensing": {
    "status": "verified",
    "spdx_expression": null,
    "licence_name": "Copernicus EMS On-Demand Mapping Terms and Conditions",
    "terms_reference": "https://mapping.emergency.copernicus.eu/terms-and-conditions/",
    "terms_reviewed_at": "2026-08-12T08:31:00Z",
    "terms_version_or_date": "Terms page last modified 2023-06-07; reviewed 2026-08-12",
    "terms_content_sha256": null,
    "commercial_use_status": "allowed",
    "attribution_requirements": "When CEMS On-Demand Mapping data are communicated to the public or distributed, recipients must be informed of the source using the applicable Copernicus/CEMS citation guidance.",
    "share_alike_or_derivative_requirements": "The reviewed terms permit adaptation, modification and combination with other data and information; no share-alike requirement is recorded. Source attribution and all other applicable terms remain required.",
    "notes": "The reviewed terms grant free access and permit reproduction, distribution, public communication, adaptation, modification and combination for CEMS On-Demand Mapping data. Some CEMS data may be restricted under applicable law, and third-party information linked from the portal can have separate licence terms. Those cases require asset-specific review and are not cleared by this manifest. This is an engineering rights assessment, not legal advice."
  },
  "redistribution": {
    "status": "allowed",
    "scope": "raw",
    "conditions": "The reviewed CEMS terms support redistribution of covered public On-Demand Mapping data with required source attribution. OpenCatastrophe currently admits metadata only: no activation product bytes are committed. Restricted/sensitive records and third-party inputs or linked information require separate rights review before acquisition or publication."
  },
  "privacy": {
    "personal_data_status": "none",
    "confidential_or_proprietary_status": "none",
    "notes": "The admitted metadata slice is limited to public provider/product/event geospatial metadata and organisational activation context; it contains no natural-person, customer, policy, claims, portfolio or confidential/proprietary fields. Free-text narrative, sensitive/restricted activations and third-party-bearing content are outside this admission and require separate review before persistence or publication."
  },
  "spatial": {
    "crs": null,
    "extent": "Global, event-specific Areas of Interest and product extents; exact CRS/geometry semantics and layer metadata must be frozen per selected activation/product"
  },
  "temporal": {
    "extent": "Operational catalogue of past and active mapping activations; exact event, activation, satellite-acquisition, delivery and product-version timestamps are activation/product specific"
  },
  "variables_and_units": [
    {
      "name": "activation metadata",
      "unit": null,
      "description": "Activation code, event/category, countries, event/activation/update times, status and related identifiers."
    },
    {
      "name": "AOI and event/product extent geometry",
      "unit": null,
      "description": "Event, Area of Interest and product geometries exposed by the public mapping interfaces; geometry representation/CRS must be preserved from the exact response or product metadata."
    },
    {
      "name": "mapped event delineation or grading",
      "unit": null,
      "description": "Product-specific observed-event, delineation or grading layers derived from Earth-observation imagery and other geospatial information."
    },
    {
      "name": "impact and exposure summary statistics",
      "unit": "varies",
      "description": "Product-specific statistics can include affected area in hectares, road length in kilometres, building counts and estimated population; field names, units and missing-value semantics must be retained exactly."
    },
    {
      "name": "satellite acquisition metadata",
      "unit": null,
      "description": "Sensor type/name, resolution class, acquisition time and product imagery metadata used for mapping context and provenance."
    }
  ],
  "transformation": null,
  "review": {
    "status": "approved_metadata_only",
    "reviewed_at": "2026-08-12T08:31:00Z",
    "reviewer": "OpenCatastrophe source audit",
    "notes": "Metadata-only engineering approval for public CEMS On-Demand Mapping activation and mapping-product metadata, with a concrete validation role against independently modelled hazard/event outputs. Raw/derived publication remains blocked until an exact public activation/product is selected, sensitivity and third-party rights are checked, product/version semantics are pinned and returned bytes are hashed and reviewed."
  }
}
