{
  "schema_version": "1.0.0",
  "dataset_id": "google.open-buildings.v3",
  "provider": "Google Research",
  "product_name": "Open Buildings",
  "version_or_release": "v3",
  "canonical_source": "https://sites.research.google/gr/open-buildings/",
  "retrieved_at": "2026-08-10T01:10:00Z",
  "retrieval_query_or_filters": "Metadata-only review of Open Buildings v3. No S2 tile, polygon, point, score-threshold or other dataset bytes were acquired. Future raw work must select and hash exact v3 assets independently.",
  "access_class": "open",
  "modelling_layer": "exposure",
  "intended_use": "Independent public building-footprint exposure-geometry source for coverage, omission, confidence-threshold and cross-source validation research. ML detections are not cadastral records, verified occupancy/construction attributes, insured locations, replacement values, vulnerability functions or claims.",
  "raw_artifact": null,
  "derived_artifact": null,
  "licensing": {
    "status": "verified",
    "spdx_expression": "CC-BY-4.0",
    "licence_name": "Creative Commons Attribution 4.0 International",
    "terms_reference": "https://sites.research.google/gr/open-buildings/",
    "terms_reviewed_at": "2026-08-10T01:10:00Z",
    "terms_version_or_date": "Open Buildings v3 dual-licence statement reviewed 2026-08-10; CC-BY-4.0 selected for this admission",
    "terms_content_sha256": null,
    "commercial_use_status": "allowed",
    "attribution_requirements": "Use Open Buildings v3 under the selected CC BY 4.0 path and provide appropriate attribution, a link to the licence and indication of changes.",
    "share_alike_or_derivative_requirements": "The selected CC BY 4.0 path has no share-alike requirement. Google also offers ODbL-1.0 as an alternative, but this admission does not select that path.",
    "notes": "The underlying satellite imagery is not part of the released dataset and is not covered by this admission. This is an engineering rights assessment, not legal advice."
  },
  "redistribution": {
    "status": "allowed",
    "scope": "raw",
    "conditions": "Source rights can support sharing under the selected CC BY 4.0 path. This manifest records repository review status approved_metadata_only. At the manifest review time, no exact v3 S2 tile or companion artifact had been selected, acquired, hashed or approved for Git publication."
  },
  "privacy": {
    "personal_data_status": "none",
    "confidential_or_proprietary_status": "none",
    "notes": "The reviewed product is a public ML-derived building-geometry dataset and does not include building type, street address, customer, policy, claims or person-level records."
  },
  "spatial": {
    "crs": null,
    "extent": "Approximately 58 million km2 across Africa, South Asia, South-East Asia, Latin America and the Caribbean; exact selected S2 tile coverage must be pinned for raw use"
  },
  "temporal": {
    "extent": "v3 inference performed May 2023 from source imagery with location-dependent freshness; no single observation date applies to every building"
  },
  "variables_and_units": [
    {
      "name": "building footprint geometry",
      "unit": null,
      "description": "ML-derived WKT POLYGON or MULTIPOLYGON geometry for polygon records."
    },
    {
      "name": "area_in_meters",
      "unit": "m2",
      "description": "Area in square metres of the detected building polygon."
    },
    {
      "name": "confidence",
      "unit": "dimensionless",
      "description": "Model confidence score documented in v3 in the range 0.65 to 1.0; filtering thresholds are separate transformation choices."
    }
  ],
  "transformation": null,
  "review": {
    "status": "approved_metadata_only",
    "reviewed_at": "2026-08-10T01:10:00Z",
    "reviewer": "OpenCatastrophe source audit",
    "notes": "Metadata-only approval for version 3. Raw/derived publication remains blocked until exact v3 tile/companion byte identities, filtering choices and scientific limitations are independently pinned and reviewed."
  }
}
