{
  "schema_version": "1.0.0",
  "dataset_id": "copernicus.c3s.european-windstorm-reanalysis.v1.0",
  "provider": "Copernicus Climate Change Service (C3S) / ECMWF",
  "product_name": "Windstorm tracks and footprints derived from reanalysis over Europe between 1940 to present",
  "version_or_release": "1.0",
  "canonical_source": "https://cds.climate.copernicus.eu/datasets/sis-european-wind-storm-reanalysis",
  "retrieved_at": "2026-08-10T00:36:00Z",
  "retrieval_query_or_filters": "Metadata-only source review. No CDS request was submitted and no source bytes were acquired. Future raw-artifact work must pin exact product, tracking algorithm, footprint configuration, resolution, time selection and returned bytes independently.",
  "access_class": "registration_required",
  "modelling_layer": "hazard",
  "intended_use": "European extratropical-windstorm event-catalogue and hazard-footprint candidate for transparent research, with DWD station observations as an independent Germany validation route. This source is not by itself an exposure, vulnerability, insured-loss or production pricing model.",
  "raw_artifact": null,
  "derived_artifact": null,
  "licensing": {
    "status": "verified",
    "spdx_expression": "CC-BY-4.0",
    "licence_name": "Creative Commons Attribution 4.0 International",
    "terms_reference": "https://cds.climate.copernicus.eu/licences/cc-by",
    "terms_reviewed_at": "2026-08-10T00:36:00Z",
    "terms_version_or_date": "CDS CC-BY licence rev. 1; CDS terms of use version 1.2 (March 2024); reviewed 2026-08-10",
    "terms_content_sha256": null,
    "commercial_use_status": "allowed",
    "attribution_requirements": "Provide attribution required by CC BY 4.0 and the dataset citation/attribution guidance. Do not imply ECMWF or the European Union endorses the use.",
    "share_alike_or_derivative_requirements": "CC BY 4.0 permits adaptation without a share-alike requirement; attribution, licence reference and indication of changes remain required.",
    "notes": "The authoritative CDS dataset/STAC metadata identifies the dataset licence as CC-BY-4.0. CDS download access requires registration and use remains subject to the licence attributed to the dataset and current CDS terms. This is an engineering rights assessment, not legal advice."
  },
  "redistribution": {
    "status": "allowed",
    "scope": "raw",
    "conditions": "Source rights support redistribution under CC BY 4.0 subject to attribution and applicable CDS conditions. OpenCatastrophe currently approves metadata only; no raw C3S artifact has been selected, acquired, hashed or approved for Git publication."
  },
  "privacy": {
    "personal_data_status": "none",
    "confidential_or_proprietary_status": "none",
    "notes": "The reviewed product consists of public meteorological reanalysis-derived windstorm tracks, gridded footprints and summary indicators."
  },
  "spatial": {
    "crs": "Regular latitude-longitude grid; exact CRS/grid metadata must be taken from each acquired product",
    "extent": "Windstorm footprints: 25°W–35°E, 30°N–70°N; tracks: 80°W–35°E, 5°N–70°N; summary indicators: Europe"
  },
  "temporal": {
    "extent": "1940 to present; the service is updated monthly, so 'present' is mutable and is not an exact artifact identity"
  },
  "variables_and_units": [
    {
      "name": "10m wind gust",
      "unit": "m/s",
      "description": "Wind-gust speed used in windstorm tracks and footprints; footprints represent the maximum 10 m wind gust over a 72-hour event-centred window."
    },
    {
      "name": "mean sea level pressure",
      "unit": "hPa",
      "description": "Mean sea level pressure at the tracked windstorm centre."
    },
    {
      "name": "normalised storm severity index (NSSI)",
      "unit": "dimensionless",
      "description": "Normalised storm severity indicator supplied in the annual summary product."
    },
    {
      "name": "storm severity index (SSI)",
      "unit": "m^5 s^-3",
      "description": "Storm severity indicator combining affected area and wind gust exceedance."
    },
    {
      "name": "yearly storm count",
      "unit": "count",
      "description": "Annual number of windstorms exceeding a configured gust threshold in a region."
    }
  ],
  "transformation": null,
  "review": {
    "status": "approved_metadata_only",
    "reviewed_at": "2026-08-10T00:36:00Z",
    "reviewer": "OpenCatastrophe source audit",
    "notes": "Metadata-only engineering approval based on authoritative CDS dataset metadata, STAC metadata and CDS licence/terms pages. The monthly-updated catalogue is not a frozen byte identity. Raw or derived publication remains blocked until an exact request/output is independently identified, acquired outside Git, hashed and reviewed for the requested publication scope."
  }
}
