{
  "schema_version": "1.0.0",
  "dataset_id": "microsoft.globalml-building-footprints",
  "provider": "Microsoft",
  "product_name": "Global ML Building Footprints",
  "version_or_release": null,
  "canonical_source": "https://github.com/microsoft/GlobalMLBuildingFootprints",
  "retrieved_at": "2026-08-10T00:55:00Z",
  "retrieval_query_or_filters": "Metadata-only review of the rolling public distribution. No dataset-links.csv snapshot, country/quadkey partition, coverage layer, or source bytes were acquired. Future raw work must pin an exact distribution-index snapshot and selected asset bytes independently.",
  "access_class": "open",
  "modelling_layer": "exposure",
  "intended_use": "Global/regional building-footprint exposure-geometry candidate for transparent spatial overlay, coverage, height-availability and source-comparison research. The ML-derived footprints and optional attributes are not authoritative cadastral/property records, insured values, occupancy, construction classes, vulnerability functions, policy data or claims.",
  "raw_artifact": null,
  "derived_artifact": null,
  "licensing": {
    "status": "verified",
    "spdx_expression": "CDLA-Permissive-2.0",
    "licence_name": "Community Data License Agreement – Permissive, Version 2.0",
    "terms_reference": "https://cdla.dev/permissive-2-0/",
    "terms_reviewed_at": "2026-08-10T00:55:00Z",
    "terms_version_or_date": "CDLA-Permissive-2.0; Microsoft repository licence statement reviewed 2026-08-10",
    "terms_content_sha256": null,
    "commercial_use_status": "allowed",
    "attribution_requirements": "When sharing data under CDLA-Permissive-2.0, make the text of the agreement available with the shared data. Preserve any separately applicable notices for selected assets; do not imply Microsoft endorsement.",
    "share_alike_or_derivative_requirements": "CDLA-Permissive-2.0 allows use, modification and sharing and does not impose a share-alike condition; its data-sharing conditions still apply.",
    "notes": "Microsoft states that the Global ML Building Footprints data are licensed under CDLA-Permissive-2.0 and freely available for download and use. This review covers the released building dataset, not underlying third-party imagery. This is an engineering rights assessment, not legal advice."
  },
  "redistribution": {
    "status": "allowed",
    "scope": "raw",
    "conditions": "Source rights can support sharing under CDLA-Permissive-2.0 when its conditions are met, including making the agreement text available with shared data. This manifest records repository review status approved_metadata_only. At the manifest review time, no exact distribution snapshot or raw/derived asset had been selected, acquired, hashed or approved for Git publication."
  },
  "privacy": {
    "personal_data_status": "none",
    "confidential_or_proprietary_status": "none",
    "notes": "The reviewed product is a publicly released dataset of ML-derived building geometries and optional model-derived attributes, not a customer, policy, claims or person-level dataset."
  },
  "spatial": {
    "crs": "EPSG:4326",
    "extent": "Global distribution with source- and update-dependent coverage gaps; exact coverage must be established for each selected snapshot/partition"
  },
  "temporal": {
    "extent": "Rolling distribution derived from source imagery with geography-dependent vintages; no single observation date applies to all footprints"
  },
  "variables_and_units": [
    {
      "name": "building footprint geometry",
      "unit": null,
      "description": "ML-derived building polygon geometry; model output rather than cadastral or legal property geometry."
    },
    {
      "name": "height",
      "unit": "m",
      "description": "Optional neural-network estimate of height above ground averaged within the building polygon; Microsoft documents -1 for structures without a height estimate."
    },
    {
      "name": "confidence",
      "unit": "dimensionless",
      "description": "Optional footprint-detection confidence between 0 and 1; not a height-confidence or general exposure-confidence measure. Microsoft documents -1 as a placeholder for older structures without this score."
    }
  ],
  "transformation": null,
  "review": {
    "status": "approved_metadata_only",
    "reviewed_at": "2026-08-10T00:55:00Z",
    "reviewer": "OpenCatastrophe source audit",
    "notes": "Metadata-only engineering approval based on Microsoft's public dataset documentation and CDLA-Permissive-2.0. Raw/derived publication remains blocked until the rolling distribution is frozen to exact selected assets, byte hashes, schema semantics and sharing conditions."
  }
}
